{
  "schema_version": 1,
  "updated_at": "2026-10-13T23:25:38+08:00",
  "repository": {
    "url": "https://github.com/MicroKeen/Mklink-AI-Probe",
    "project_root": "Mklink-AI-Probe",
    "branch": "codex/0.3.5-fixes",
    "head": "cf118751 backend repair; 75a73a5a production Web; subsequent verification documentation commit.",
    "remote_head": "codex/0.3.5-fixes pushed; PR43 draft against microkeen/main 185678c59623.",
    "working_tree": "Isolated repair branch; source, tests, production Web and verification. Local desktop candidate installed; no merge or release."
  },
  "mission": {
    "product": "维护 MKLink 烧录、调试、桌面/Web、Skill/CLI/MCP。"
  },
  "current_session": {
    "status": "complete",
    "current_task": "0.3.5 SuperWatch修复及WebGUI/Skill/桌面一致性核对完成，PR43草稿。统一元数据时钟，Python3.11/3.14与偏差回归通过；V3/F103及真实浏览器各入口约260k、零缺口/丢弃。用户要求重试后NSIS实际覆盖安装退出0、4载荷哈希一致；已安装MCP/Web两组实机及原生启动/退出通过。全局Skill未替换，候选包通过；客户原机复测和正式发布待后续。"
  },
  "milestones": [
    {
      "name": "0.3.5 SuperWatch时钟修复",
      "status": "complete",
      "notes": "源修复、定向回归、真实Web/MCP/硬件、候选包一致性及实际覆盖安装完成；PR43草稿，未发布0.3.5。"
    },
    {
      "name": "0.3.4正式版",
      "status": "complete",
      "notes": "PR40，源a8fd3fab0403；实际覆盖安装/Skill更新、五份更新验签、三平台原生CI38144587775、三渠道正式发布完成。后续交接与正式Web另走PR，标签不移动。"
    },
    {
      "name": "0.3.3正式版",
      "status": "complete",
      "notes": "源11616f80，PR38；Windows/ARM/Linux/Intel包、五份签名、三渠道核对和本地Skill更新完成。正式归档已回原工作空间；见v033-release-handoff.md。"
    },
    {
      "name": "0.3.2正式版",
      "status": "complete",
      "notes": "源3d511e94，PR35/36；三平台原生构建38028928283。Windows实装、五份更新验签、三个渠道已核对，见v032-release-handoff.md。"
    },
    {
      "name": "0.3.1正式版",
      "status": "complete",
      "notes": "PR33合并，源1d61159d；签名NSIS/Skill/SiteAgent与三端索引完成，最终提取包检查通过。见v031-release-handoff.md。"
    },
    {
      "name": "0.3.0及2026-10-09固件归档",
      "status": "complete",
      "notes": "0.3.0发布及2026-10-09固件记录见历史交接和固件归档；不继承其硬件验收结论。"
    }
  ],
  "verification": [
    {
      "area": "0.3.5 SuperWatch环境时钟差异",
      "result": "默认时钟与注入时钟、正负34.8秒偏差、无batch_time、1秒边界和64批队列回归；Python3.11.16 152通过，Python3.14.5 392通过。V3/F103单float、30MHz、每组约10秒：1us 261664/259304Hz，50us 21685/21676Hz；四组浏览器与后台丢弃0。详见docs/verification/v035-superwatch-clock.md。 另107项分发/runtime/MCP通过、1项可选hil_core跳过；GUI206通过。195源码/38Web资源及冻结方法字节码一致。Skill/冻结MCP各测1us/50us零缺口丢弃；Windows-only PATH原生WebView35秒9230741读零错误/丢弃，关闭窗口后台正常退出。首次UAC取消，用户要求重试后NSIS退出0；4安装载荷哈希一致，已安装MCP/真实Edge两组约262k/20k零缺口丢弃，原生窗口和后台正常退出。运行代码75a73a5a三个PR CI通过；最终文档头需另核对CI。"
    },
    {
      "area": "0.3.4 正式发布与本地升级",
      "result": "最终源a8fd3fab0403；正式NSIS176582092字节，实装载荷哈希匹配；冻结CLI/MCP/38 Web文件/原生窗口及退出通过。F103双探针固定后台、采集中24写应答、5766周期零读错误通过；SystemView54字节仅证生命周期。三平台native CI38144587775、五份签名实际验签、17附件匿名下载及三渠道索引、本地Skill逐文件/CLI/MCP通过。见v034-release-handoff.md，早期准备与体积审计证据仍保留原报告。"
    },
    {
      "area": "0.3.4 明确断开与切换自动收尾",
      "result": "源34834d08/5f4b9728，协议52，生产Web已构建。830项相关Python通过，随后队列/SDK115、最后迟到请求71通过；87项GUI/TypeScript/构建通过。V3/F103原ELF、30MHz/1ms、RTT+Watch双AI订阅直接断开成功；共享AI下采集中切到第二只、旧会话拒绝，AI断开和SDK A→B→A均保持后台身份。最终代码再次完整真机复核通过且读错误0。两个真实页面自动同步断开/切换，额外页已关。SystemView短程54字节/0解码事件，AI断开成功，仅证明生命周期不宣称解码性能。异步烧录和迟到请求用确定性夹具覆盖，未中断实物烧录。见v034-explicit-connection-control.md。"
    },
    {
      "area": "0.3.4 SuperWatch取消回读校验",
      "result": "源267b175f及其生产Web。旧版真实复现自增变量写入readback mismatch并停止采集。385项Python、72项GUI、TypeScript和生产构建通过。V3.6.4/F103原ELF、30MHz/1ms两波形+RTT，24次写入应答全部成功，4450周期零读错误、RTT31行；独立测试读确认静态字变化再恢复，70605周期零读错误。真实浏览器动态变量写12后显示已写入且运行中，最新GUI保留。旧SW01/HPM仅源码及模拟协议验证，无新固件修改。见v034-superwatch-write.md。"
    },
    {
      "area": "0.3.4 窗口固定后台与原地切换",
      "result": "源50eb6c52/Web504e690d。Python全量初跑4771通过/2跳过，1旧参数断言失败及4缺FLM资源夹具错误；更新断言后相关1177通过，最后双页面保护29通过。指定既有本地资源后干净实包5通过，冻结后台用runtime_id发现后复用新实包重跑1通过。GUI全量938通过/2旧导航夹具失败，补充状态及换目标清空表单断言后2通过，最终940项覆盖；生产构建通过。两只实物、两个独立代理/Web：A→B→A后台身份不变，RTT+Watch及Trace运行中切换清空旧目标。独立窗口占用B时拒绝切入而A采集继续；双方释放/接手均不重启后台。最终代码再次A→B→A保持PID/端口。原位置ELF5365变量；3秒RTT30行/Watch283周期读错误0，Trace14093事件。B无目标板。保留一最终WebGUI供用户测试。见v034-window-owned-backend.md。"
    },
    {
      "area": "0.3.4 采集启动与通信",
      "result": "源 ddda89c5；Python 全量4752通过/2旧读取顺序断言失败/2跳过，更新断言后相关487通过，最后边界与断连177通过；最终合计4757通过用例/2跳过。GUI全量936通过，补改冲突提示后SystemView25通过，最终937用例；生产构建通过。6万符号ELF基准20–22秒→1.45–1.51秒；V3/F103 RTT8+Watch3+跨客户端内存约126秒，读错误0；Trace三次0.53–0.66秒。最终冷启RTT0.328秒、Watch35209周期0错误、Trace0.354秒/123150事件；Web13任务72MHz/331969事件/drop0，停止释放通过。见v034-rtt-startup.md。 后续原工程原地编译/烧录校验通过，直接加载原 Obj AXF：RTT 0.246秒，Watch 35225周期0错误，Trace 0.379秒/122139事件；后台释放。05faf1e3 的三项 PR CI 全通过。 切换源4c1227b9：最终594项Python、70项GUI及生产构建通过；失效偏好下真机连接/RAM/RTT成功，页面重选后4876外设项、两次新后台冷启恢复；双实体A→B→A→B不影响另一窗口RTT，126次内存检查0错误，符号generation不变，后台释放。见v034-probe-switch-peripherals.md。 上述跨后台跳转属于旧方案，已被50eb6c52窗口固定后台方案取代，见最新验证。"
    },
    {
      "area": "0.3.3 正式发布",
      "result": "精确main11616f80重建Windows/Skill/SiteAgent；ARM/Linux CI38069170299，Intel详细重跑38071279659成功。三个native清单及冻结CLI/MCP/退出通过，五份签名实际验签。正式Windows提取包Windows-only PATH、35Web资源、原生界面/区域高度/退出通过；不计本次UAC取消为重新安装。两GitHub各17公开附件与三渠道回读验证，本地Skill逐文件核对并验证CLI/SVD/MCP；详见v033-release-handoff.md。"
    },
    {
      "area": "0.3.3候选与在线烧录归档",
      "result": "候选、GUI、全量Python、安装、FLM资源和在线烧录布局证据见v033-release-readiness.md及v033-online-flash-algorithms.md；原始报告保留。"
    }
  ],
  "decisions": [
    "应用开发从MicroKeen/main建codex分支，经PR、CI整合；发布及合并需明确授权，标签/资产不可覆盖。",
    "0.3保留CDC：USB序列号校验当前连接及MSC，本机别名不写固件；多设备不选第一台，丢失身份拒绝新操作，不重放。GUI/MCP和已迁移CLI不再有--direct；Python脚本新增共享SDK，低层Device仍供后台/专用工具使用。后台协议51，内嵌远程服务已接入共享会话，仅允许绑定物理探针后台。 工程上下文固定于后台生命周期；删除旧PUT热切换入口，换工程须显式停止该探针后台再启动。 发现统一被动MI_04枚举，删除discover/自动连接全局锁/失败遍历与保存COM；底层自动连接也只接受唯一候选。 CDC和MSC共用probes当前独占身份，只有停止旧采集、关闭旧设备且取得目标OS锁后才允许原地改绑，Bridge开口前后校验，lobby拒绝CDC/MSC/目标访问，允许独立UART会话；不是原子句柄身份认证。",
    "应用MicroKeen/release主索引，旧GitHub/updates与Gitee/updates兼容；探针固件独立firmware索引。V2 RBL仅附件。",
    "用户授权正式发布0.3.2与V3.6.4/V4.6.8/HPMLink4.6.8；原MK-Firmware同步最新，旧用户固件仅归档备份，不恢复stash。",
    "用户接受30MHz并行目标读错留待下版，不写公开发布说明；Mac/Linux实机后验，Windows本轮已实际覆盖安装通过。",
    "原Mklink-AI-Probe是唯一维护入口。0.3.3正式包/证据已回原.build/artifacts/v033-official；F盘为构建缓存。交接PR合入后删除startup-cdc临时工作树并记录结果，保留共享依赖和必要客户证据。",
    "mklink及既有长期跟进维持暂停；不得因旧交接自动接管硬件或重复发布。",
    "用户明确授权合并0.3.3修复分支、签名正式发布、更新本地Skill及清理临时工作树；PR38已合入并发布。探针连接/时钟不要求目标板；固件需要改动时另开会话。Gitee缺失镜像沿用此前GitHub兜底，渠道最后写入。",
    "用户特别要求：锁相关修复必须结合整体共享架构，不能仅消除当前卡点。保留唯一串口所有权、USB身份绑定、会话/操作锁及未知结果不重放；审查读写控制顺序、epoch隔离、取消完成前缓冲寿命、背压错误传播和端口释放，再以跨客户端与真实进程/硬件验证。 父进程仅在worker真正退出后发布串口关闭，避免其他线程提前释放应用锁。 0.3.4 继续保留这些边界；单次调用上下文缓存 RAM，未知响应不重放，错误可见不提前释放采集所有权。 用户明确纠正：一个GUI客户端持有固定后台，同窗口切换不新建/跳转后台，RTT/Watch/Trace等必须跟随当前设备并清空旧目标状态。另开客户端才新建独立后台；占用目标先在原窗口断开，禁止偷取。SDK/AI按物理身份发现当前持有者；共享会话和多个页面不阻止明确断开/切换；在途操作先收尾，再自动处理。旧目标会话注销，独立UART保留。外设ID使用Pack版本/型号/SVD相对路径，失效偏好仅禁用外设目录，不阻断设备；无法反推的旧ID由用户重选。",
    "测试工程直接在用户指定原目录修改和构建，直接使用其 build/keil/Obj ELF，不再复制工程到其他目录；用户允许任意测试修改，不要求备份还原。详细硬件路径仅留本地。 用户明确要求SuperWatch变量写入取消回读校验，只认写应答；不取消烧录或显式内存校验，不掩盖真实写失败，不自动重放。 用户取消共享客户端/采集对断开与切换的拒绝：明确请求必须自动收尾处理。同后台PID固定，旧目标请求不得跨设备，MCP disconnect物理断开、detach只退出自身。"
  ],
  "hardware": {
    "state": "本轮修复源码Python3.11/3.14及Skill/NSIS候选均以共享后台连接V3/F103原AXF，30MHz、1us/50us通过；原生WebView35秒923万读0错误。所有采集已停止，测试浏览器/SDK/native窗口及后台已退出；未改固件/供电。",
    "installer": "0.3.5修复分支本地NSIS候选已实际覆盖安装，退出0，4文件哈希与候选一致；仍保留0.3.4版本标识、cf118751构建标识。已安装冻结MCP/WebGUI实机1us/50us约262k/20k、零缺口丢弃，Windows-only PATH原生窗口及正常退出通过。全局Skill未替换，候选已解包核对/MCP/HIL通过。",
    "backups": "原Git根.build/artifacts/v033-official保存17正式文件、archive-manifest及qualification（含候选实装/F103、正式冻结/签名/渠道/Skill证据）；旧0.3.2正式归档及用户备份保持。F盘保留共享缓存；联接测试目录和旧安装器占用文件不强删。"
  },
  "known_limits": [
    "0.3.5时钟修复已通过偏差注入及本地Windows3.11/3.14实机短测；客户3.11.9原电脑仍待升级确认。原始CDC首次离线/F405 PROGRAM100%后退出、受限AI/GD32及RTT客户后续MUX超时仍未闭环；不宣称同一根因或任意负载无损。历史unknown操作不得重放。",
    "V4.6.8 30MHz RTT8/Watch4/UART并行目标读错1kHz +1、最大+273；10MHz0。旧V4.6.6原始+1/+224，报告此前漏记已更正。采集不停止、不误断、UART完整；用户明确继续发布，限制交接下版处理，不写公开发布说明。",
    "HPM/SES退出未发送DAP_Disconnect时可遗留占用，后续legacy握手等待；明确退出后正常OpenOCD init/resume/shutdown可恢复，用户可重插USB。禁止任意超时偷取调试所有权。完整SES矩阵和RTT下行未全部覆盖；V3.6.4/V4.6.8仿真中新启采集及负载读回通过，V4.6.8已完成Keil及相关矩阵。详见release handoff；长期目标暂停。",
    "性能和功能证据按docs/verification/v030-release-handoff.md及各精确提交报告解释：采集不是无损通道，缓冲溢出/暂停/调试下载可能丢失观测；多变量不是原子快照，不能保证任意时序上界。",
    "V3无屏幕、不支持HPM；V3.6.4原生Keil先运行再采集、暂停/单步/继续/退出和OpenOCD均通过。V4最终无诊断固件完整SES矩阵未完成。",
    "后台最后会话释放约5秒租约，加排空和退出开销；不保证硬实时5秒。每个GUI客户端一个后台，同窗口切换固定PID/端口；一个物理探针在任一时刻仅由一个后台独占。打开已有URL的额外页面共享当前后台并跟随明确切换；独立操作应启动新客户端。",
    "长期验证按用户要求暂停；跨物理主机Agent、Mac/Linux、真实Modbus从站及全部芯片组合未完整认证。模拟测试不得替代实体边界。",
    "nRF54L15 GUI保护闭环、全部物理擦除/拔插/休眠/断电场景、电源外部精度校准未全部认证。VCC每次改动必须确认具体电压，HPM已锁定OTP不得重放。 已知无可靠扇区表的26个FLM禁用扇区操作；重叠算法需要匹配Bank模式。"
  ],
  "next_actions": [
    "审查PR43 codex/0.3.5-fixes并核对最终CI；客户原机升级确认元数据频率/丢弃。合并、版本提升和正式发布仍需维护者授权；全量发布门禁未由定向验证替代。",
    "收集两位 RTT 客户的上位机/下载器固件版本、目标 ELF/芯片及 IDE 占用，用启动阶段耗时和 MUX 请求身份复核。历史 unknown 操作不得重放；原始 CDC/F405/受限 AI/GD32 仍待现场闭环。",
    "继续排查 30MHz 并行目标读错/Flash 偶发 status5，区分固件目标访问与主机队列；本次低负载 F103 结果不关闭该限制，需要固件改动另开会话。",
    "Gitee单附件限制已确认100MB：0.3.4 Skill已真实镜像并验证GitHub不可达回退，Windows176.6MB被拒并使用GitHub链接；后续发布必须维持Gitee Skill可下载，其他平台不上传Gitee。历史联接/占用目录留人工处理。",
    "收集 Mac/Linux USB/MSC 和原地升级反馈、外置 Flash 多算法实物验证；完整 SES/芯片/拔插断电组合仍待补充。供电每次确认具体电压，长期验证仍暂停。"
  ],
  "continuation_protocol": [
    "交接只保存现状、关键限制和报告索引；详细历史留在docs/verification。"
  ]
}
